Unnamed: 0,product_name,shop_name,location,price,discount,amount_sold,rating,no_of_rating,link_product
0,SALE ‼‼   ORIGINAL 100%  VANS OLD SKOOL BLACK/WHITE,frigo.id,"KOTA JAKARTA SELATAN - PASAR MINGGU, DKI JAKARTA, ID",Rp345.000 - Rp499.000,51% off,"2,1RB",4.8,"1,2RB",/SALE-‼‼-ORIGINAL-100-VANS-OLD-SKOOL-BLACK-WHITE-i.216875785.5515635728?ads_keyword=vans%20oldskool%20black%20white%20premium&adsid=7315613&campaignid=5526778&position=0
1,(2PCS = 1KG) VANS_99 OLDSKOOL HITAM NAVY MAROON GREY GRADE ORI PREMIUM,jackrepublic_sby,"KOTA SURABAYA - RUNGKUT, JAWA TIMUR, ID",Rp39.900 - Rp49.900,58% off,1RB,4.5,478,/(2PCS-1KG)-VANS_99-OLDSKOOL-HITAM-NAVY-MAROON-GREY-GRADE-ORI-PREMIUM-i.129226120.6161582085?ads_keyword=sepatu%20vans&adsid=24446270&campaignid=14488129&position=1
2,Vans Sepatu Vans Old School Vans Original Black White Chekerboad Navy Maroon Classic Pria Wanita,rizki_collectionn,"KAB. BANDUNG - BANJARAN, JAWA BARAT, ID",Rp132.990,34% off,"6,4RB",4.7,"3,7RB",/Vans-Sepatu-Vans-Old-School-Vans-Original-Black-White-Chekerboad-Navy-Maroon-Classic-Pria-Wanita-i.333977623.4372159544?ads_keyword=sepatu%20sneakers%20vans&adsid=31569070&campaignid=18970227&position=2
3,(BISA COD) 5 PILIHAN WARNA SEPATU OLDSKOOL PREMIUM SNEAKERS OLD SCHOOL PRIA WANITA,taba_shoes_store,"KAB. BANDUNG - MARGAASIH, JAWA BARAT, ID",Rp180.000,25% off,"9,9RB",4.8,"4,6RB",/(BISA-COD)-5-PILIHAN-WARNA-SEPATU-OLDSKOOL-PREMIUM-SNEAKERS-OLD-SCHOOL-PRIA-WANITA-i.108026952.1742361902?ads_keyword=vans&adsid=2058592&campaignid=2058592&position=3
4,V4NS DOUBLE  POKSING  O.S OG PREMIUM IMPOR,kubilandri,"KAB. TANGERANG - TIGARAKSA, BANTEN, ID",Rp110.000,45% off,352,4.7,201,/V4NS-DOUBLE-POKSING-O.S-OG-PREMIUM-IMPOR-i.70325473.4336876386?ads_keyword=wkdaelpmissisiht&adsid=17689934&campaignid=7115206&position=4
5,Sepatu Sneakers Old Skool Black White Vns slip on Motif catur bw Vans SK Delapan Low COD,nur_azizah_colection,"KAB. TANGERANG - PASAR KEMIS, BANTEN, ID",Rp49.400 - Rp52.000,5% off,997,4.6,452,/Sepatu-Sneakers-Old-Skool-Black-White-Vns-slip-on-Motif-catur-bw-Vans-SK-Delapan-Low-COD-i.347545594.4978724765?position=5
6,SEPATU VANS OLD SKOOL (GREED ORI),wawan_shop,"KAB. TANGERANG - SEPATAN, BANTEN, ID",Rp48.750 - Rp52.500,35% off,"8,7RB",4.7,"3,8RB",/SEPATU-VANS-OLD-SKOOL-(GREED-ORI)-i.18018345.6549373661?position=6
8,COD PROMO SEPATU VANS OLDSKOOL HITAM MARON NAVY SIZE 36-44 TERLARIS,yostar.shoes,"KAB. MOJOKERTO - PURI, JAWA TIMUR, ID",Rp79.800 - Rp88.200,16% off,"5,9RB",4.8,"3,4RB",/COD-PROMO-SEPATU-VANS-OLDSKOOL-HITAM-MARON-NAVY-SIZE-36-44-TERLARIS-i.328342490.3278083873?position=8
10,SEPATU VANS SEKOLAH KASUAL HITAM OLDSKOOL /PUTIH PRIA LAKI COWOK VENS OLAHRAGA LARI RUNNING KEREN,rapayurapopo_82,"KOTA JAKARTA BARAT - KEBON JERUK, DKI JAKARTA, ID",Rp65.000,50% off,"3,2RB",4.6,"1,6RB",/SEPATU-VANS-SEKOLAH-KASUAL-HITAM-OLDSKOOL-PUTIH-PRIA-LAKI-COWOK-VENS-OLAHRAGA-LARI-RUNNING-KEREN-i.140582312.4136420587?position=10
11,BIG SALE 9.9 sepatu pria VANS AUTHENTIC LX OG CLASSIC BLACK WHITE/ sepatu pria terbaru/sepatu kasual,maher_store,"KAB. BOGOR - TAMANSARI, JAWA BARAT, ID",Rp45.000,10% off,3RB,3.9,31,/BIG-SALE-9.9-sepatu-pria-VANS-AUTHENTIC-LX-OG-CLASSIC-BLACK-WHITE-sepatu-pria-terbaru-sepatu-kasual-i.315816074.8450415867?position=11
12,sepatu Vans old skool Fetino sepatu kasual pria wanita // Autentik Fans / Vens Fatino,rapayurapopo_82,"KOTA JAKARTA BARAT - KEBON JERUK, DKI JAKARTA, ID",Rp69.000,37% off,"3,1RB",4.6,"1,7RB",/sepatu-Vans-old-skool-Fetino-sepatu-kasual-pria-wanita-Autentik-Fans-Vens-Fatino-i.140582312.3453393526?position=12
13,SEPATU VANS_REVENGE X STORM BLACK WHITE OLD SKOOL VANS01 SNEAKERS CASUAL PRIA WANITA,fahmisaepul07,"KAB. TANGERANG - PASAR KEMIS, BANTEN, ID",Rp45.000,55% off,71,4.5,36,/SEPATU-VANS_REVENGE-X-STORM-BLACK-WHITE-OLD-SKOOL-VANS01-SNEAKERS-CASUAL-PRIA-WANITA-i.164203093.9311085380?position=13
15,sepatu kasual vans x national geographic sneakers pria terbaru,osa_store,"KOTA BANDUNG - UJUNG BERUNG, JAWA BARAT, ID",Rp100.000,50% off,702,4.5,404,/sepatu-kasual-vans-x-national-geographic-sneakers-pria-terbaru-i.81268489.6456518732?position=50
17,Sepatu Pria Era Authentic Sneakers Vans Authentic Full Black Sepatu Kerja Sepatu Casual Hitam Polos,galang96_,"KAB. TANGERANG - PASAR KEMIS, BANTEN, ID",Rp60.000,40% off,574,4.5,20,/Sepatu-Pria-Era-Authentic-Sneakers-Vans-Authentic-Full-Black-Sepatu-Kerja-Sepatu-Casual-Hitam-Polos-i.189235009.9055244639?position=52
18,COD PROMO DISKON SEPATU VANS OLDSKOOL PRIA WANITA SIZE 36-44 SEPATU HITAM SEPATU SEKOLAH,sepatusyafa,"KAB. MOJOKERTO - PURI, JAWA TIMUR, ID",Rp58.000,,144,4.9,86,/COD-PROMO-DISKON-SEPATU-VANS-OLDSKOOL-PRIA-WANITA-SIZE-36-44-SEPATU-HITAM-SEPATU-SEKOLAH-i.359988144.9413913145?position=53
19,SNEAKERS TERMURAH DAN TERKEREN DI TAHUN 2021 SEPATU VANS NEW,fikrie_shop01,"KAB. BOGOR - CIOMAS, JAWA BARAT, ID",Rp54.450,45% off,"2,4RB",3.9,155,/SNEAKERS-TERMURAH-DAN-TERKEREN-DI-TAHUN-2021-SEPATU-VANS-NEW-i.428381132.8248685806?position=54
20,(BONUS SANDAL VANS) SEPATU VANS OLDSKOOL BLACK WHITE - SNEAKERS VANS OLD SKOOL PREMIUM MURAH - osbw1,kello_id,"KOTA SURABAYA - BUBUTAN, JAWA TIMUR, ID",Rp155.000,56% off,7RB,4.8,878,/(BONUS-SANDAL-VANS)-SEPATU-VANS-OLDSKOOL-BLACK-WHITE-SNEAKERS-VANS-OLD-SKOOL-PREMIUM-MURAH-osbw1-i.154702106.5258529245?ads_keyword=sepatu%20vans&adsid=23456499&campaignid=13857757&position=55
21,(BISA COD - FREE GANTUNGAN KUNCI) Sepatu Vans Authentic Black White - Sneakers Vans Authentic aubw,sneakersuper.co,"KOTA SURABAYA - BUBUTAN, JAWA TIMUR, ID",Rp145.000,59% off,"7,5RB",4.8,"2,6RB",/(BISA-COD-FREE-GANTUNGAN-KUNCI)-Sepatu-Vans-Authentic-Black-White-Sneakers-Vans-Authentic-aubw-i.146772054.5560137521?ads_keyword=sepatu%20vans&adsid=23761327&campaignid=14057949&position=56
22,100% Import Vans Oldskool Ivory Black White,sandrisofficial,"KOTA CIMAHI - CIMAHI UTARA, JAWA BARAT, ID",Rp190.000,46% off,"2,4RB",4.7,"1,4RB",/100-Import-Vans-Oldskool-Ivory-Black-White-i.133928344.2883864057?ads_keyword=sepatu%20vans&adsid=10496070&campaignid=6961299&position=57
23,SEPATU VANS OLDSKOOL GRADE ORIGINAL TERMURAH,izdihaar_store94,"KAB. MOJOKERTO - PURI, JAWA TIMUR, ID",Rp49.900 - Rp59.900,58% off,"2,1RB",4.6,"1,1RB",/SEPATU-VANS-OLDSKOOL-GRADE-ORIGINAL-TERMURAH-i.215290045.7713511031?ads_keyword=sepatu%20vans&adsid=23525820&campaignid=13904563&position=58
25,(BONUS TOTE BAG / KAOS KAKI / PAPER BAG) SEPATU VANS OLDSKOOL CLASSIC BLACK WHITE - osbw,kello_id,"KOTA SURABAYA - BUBUTAN, JAWA TIMUR, ID",Rp136.000,,6RB,4.7,464,/(BONUS-TOTE-BAG-KAOS-KAKI-PAPER-BAG)-SEPATU-VANS-OLDSKOOL-CLASSIC-BLACK-WHITE-osbw-i.154702106.9221505184?ads_keyword=sepatu%20vans&adsid=46703063&campaignid=28394469&position=60
26,Vans Old Skool original Sepatu Vans Original Sneakers Old School Premium,bhinekashop,"KAB. BANDUNG - BANJARAN, JAWA BARAT, ID",Rp115.000,58% off,201,4.8,92,/Vans-Old-Skool-original-Sepatu-Vans-Original-Sneakers-Old-School-Premium-i.386203128.11217802558?ads_keyword=sepatu%20vans&adsid=55248905&campaignid=33582912&position=61
27,Sepatu Sneakers Unisex PRIA WANITA TERLARIS SEPATU VANS OLD SKOOL BLACK WHITE CLASIC 001,kujanggrosirbandung,"KOTA BANDUNG - ANTAPANI (CICADAS), JAWA BARAT, ID",Rp161.500 - Rp170.000,5% off,9,4.8,4,/Sepatu-Sneakers-Unisex-PRIA-WANITA-TERLARIS-SEPATU-VANS-OLD-SKOOL-BLACK-WHITE-CLASIC-001-i.429837088.11408390513?ads_keyword=wkdaelpmissisiht&adsid=54403819&campaignid=33128734&position=62
28,VANS OLD SKOOL FORGOTTEN BONES BLACK WHITE ORIGINAL 100%,clawstore.sneak,"KOTA JAKARTA SELATAN - PASAR MINGGU, DKI JAKARTA, ID",Rp850.000 - Rp875.000,23% off,14,5.0,8,/VANS-OLD-SKOOL-FORGOTTEN-BONES-BLACK-WHITE-ORIGINAL-100--i.232020050.9601003856?ads_keyword=sepatu%20vans%20pria&adsid=29742654&campaignid=17801261&position=63
29,Sepatu Oldskool Og Sneakers Pria Wanita Premium Import,rimbashop,"KAB. TANGERANG - SEPATAN, BANTEN, ID",Rp135.000,46% off,"1,5RB",4.7,322,/Sepatu-Oldskool-Og-Sneakers-Pria-Wanita-Premium-Import-i.115671792.9814639493?ads_keyword=vans&adsid=37503159&campaignid=22628315&position=64
30,VANS OLDSKOOL BLACKWHITE / VANS TERMURAH / VANS KEKINIAN / VANS TERBARU / SEPATU COUPLE,aleta_shopping,"KOTA SURABAYA - DUKUH PAKIS, JAWA TIMUR, ID",Rp49.800 - Rp99.600,17% off,176,4.7,100,/VANS-OLDSKOOL-BLACKWHITE-VANS-TERMURAH-VANS-KEKINIAN-VANS-TERBARU-SEPATU-COUPLE-i.6212608.6346851104?position=65
31,Sepatu Vans Sneakers Casual Pria Oldscull Murah Authentich Full Print,lodaya290183,"KAB. BANDUNG - BOJONGSOANG, JAWA BARAT, ID",Rp72.500,52% off,"5,6RB",4.7,"2,8RB",/Sepatu-Vans-Sneakers-Casual-Pria-Oldscull-Murah-Authentich-Full-Print-i.4095539.1850861145?position=66
32,Sepatu Vans Old Skool full black / sepatu sekolah / sepatu casual / sepatu skate / vans hitam polos,xiazevs,"KAB. TANGERANG - PASAR KEMIS, BANTEN, ID",Rp51.100 - Rp56.000,27% off,"2,6RB",4.6,"1,4RB",/Sepatu-Vans-Old-Skool-full-black-sepatu-sekolah-sepatu-casual-sepatu-skate-vans-hitam-polos-i.27952847.2123911025?position=67
33,Sepatu Wanita Slip on Putih Polos Sepatu Pria Vans Original Full White Premium Quality Terlaris,haitunani_store,"KOTA JAKARTA SELATAN - KEBAYORAN BARU, DKI JAKARTA, ID",Rp125.000,,"1,1RB",4.9,17,/Sepatu-Wanita-Slip-on-Putih-Polos-Sepatu-Pria-Vans-Original-Full-White-Premium-Quality-Terlaris-i.302832475.9372513012?position=68
34,TERMURAH!! SEPATU VANS SLIP ON CHECKERBOARD OG SNEAKRES TERMURAH SLIPON CATUR BW OLD SKOOL TERLARIS,diva.grosir,"KOTA TANGERANG - TANGERANG, BANTEN, ID",Rp52.000,65% off,75,4.6,31,/TERMURAH!!-SEPATU-VANS-SLIP-ON-CHECKERBOARD-OG-SNEAKRES-TERMURAH-SLIPON-CATUR-BW-OLD-SKOOL-TERLARIS-i.269536516.4390743972?position=69
35,SEPATU VANS SLIPON OG BLACK WHITE - VANS SLIPON OG HITAM PUTIH PRIA WANITA | 9.9 SALE !! SOBWOG,supers_shoes,"KOTA SURABAYA - WONOKROMO, JAWA TIMUR, ID",Rp130.000,47% off,"7,9RB",4.8,368,/SEPATU-VANS-SLIPON-OG-BLACK-WHITE-VANS-SLIPON-OG-HITAM-PUTIH-PRIA-WANITA-9.9-SALE-!!-SOBWOG-i.304246573.7882312832?position=70
36,NEW ARRIVAL!! SEPATU V4NS SLIP ON ASHLEY WILMS NEWS PAPER WHITE MOTIF KORAN,rizkyconverse,"KAB. TANGERANG - PANONGAN, BANTEN, ID",Rp134.400,52% off,515,4.7,272,/NEW-ARRIVAL!!-SEPATU-V4NS-SLIP-ON-ASHLEY-WILMS-NEWS-PAPER-WHITE-MOTIF-KORAN-i.76454443.9428336196?position=71
38,Sepatu Pria Kasual Vans Era Authentic Putih Size 36-43 Sepatu Kerja / Sepatu Sneakers Sepatu Wanita,suksesstore15,"KAB. TANGERANG - PASAR KEMIS, BANTEN, ID",Rp60.000,40% off,265,4.3,87,/Sepatu-Pria-Kasual-Vans-Era-Authentic-Putih-Size-36-43-Sepatu-Kerja-Sepatu-Sneakers-Sepatu-Wanita-i.269290992.3883296916?position=73
39,SEPATU VANS ZAPATO GREEN ARMY KUALITAS ORIGINAL PREMIUM BNIB WAFFLE DT,peronikafootwear,"KOTA BANDUNG - PANYILEUKAN, JAWA BARAT, ID",Rp175.000,30% off,11,5.0,8,/SEPATU-VANS-ZAPATO-GREEN-ARMY-KUALITAS-ORIGINAL-PREMIUM-BNIB-WAFFLE-DT-i.103266705.8822905559?position=74
40,FLASH SALE VANS OLD SKOOL | VANS STYLE 36 DECON WOVEN CHECKERBOARD | VANS CHECKERBOARD | VANS ORI,clawstore.sneak,"KOTA JAKARTA SELATAN - PASAR MINGGU, DKI JAKARTA, ID",Rp499.000 - Rp715.000,,248,4.9,79,/FLASH-SALE-VANS-OLD-SKOOL-VANS-STYLE-36-DECON-WOVEN-CHECKERBOARD-VANS-CHECKERBOARD-VANS-ORI-i.232020050.3967763611?ads_keyword=vans%20og&adsid=34390739&campaignid=20721705&position=120
41,Sepatu Sneakers Pria Vans Authentic Era Hitam Putih Oldskool Sneakers Wanita,rizki_collectionn,"KAB. BANDUNG - BANJARAN, JAWA BARAT, ID",Rp132.300,46% off,103,4.6,61,/Sepatu-Sneakers-Pria-Vans-Authentic-Era-Hitam-Putih-Oldskool-Sneakers-Wanita-i.333977623.7479142660?ads_keyword=sepatu%20vans%20authentic&adsid=36929119&campaignid=22287087&position=121
42,Sepatu Sneakers Pria Vans Old Skool Black White TANPA BOX,sepatu_slop,"KAB. BANDUNG - CIPARAY, JAWA BARAT, ID",Rp44.000 - Rp47.000,56% off,"2,3RB",4.3,"1,2RB",/Sepatu-Sneakers-Pria-Vans-Old-Skool-Black-White-TANPA-BOX-i.15482688.1945979180?ads_keyword=sepatu%20vans&adsid=22485575&campaignid=13233187&position=122
43,(BUY 1 GET 1) ORIGINAL BNIB VANS OLD SKOOL CLASSIC BLACK WHITE MADE IN CHINA,goritna,"KOTA SURABAYA - BUBUTAN, JAWA TIMUR, ID",Rp399.000,49% off,105,5.0,4,/(BUY-1-GET-1)-ORIGINAL-BNIB-VANS-OLD-SKOOL-CLASSIC-BLACK-WHITE-MADE-IN-CHINA-i.226901391.3873106322?ads_keyword=sneakers%20vans&adsid=33481275&campaignid=20164384&position=123
44,Siap Kirim Sepatu Vans Oldskool Bw N All White Sket Sekolah Olahraga Santai Sport Murah,detyhandayani,"KAB. TANGERANG - PASAR KEMIS, BANTEN, ID",Rp49.600 - Rp52.000,38% off,10RB+,4.7,"7,2RB",/Siap-Kirim-Sepatu-Vans-Oldskool-Bw-N-All-White-Sket-Sekolah-Olahraga-Santai-Sport-Murah-i.108187752.7720606347?ads_keyword=sepatu%20vans&adsid=8074349&campaignid=5860419&position=124
45,Sepatu Vans Venera Fullblack Sneakers Pria Wanita Sekolah Kerja Kuliah Warna Hitam Polos Traning,zahrashoes1,"KAB. TANGERANG - SEPATAN, BANTEN, ID",Rp54.000,55% off,112,4.6,56,/Sepatu-Vans-Venera-Fullblack-Sneakers-Pria-Wanita-Sekolah-Kerja-Kuliah-Warna-Hitam-Polos-Traning-i.45200498.2617627581?position=125
46,Sepatu Vans Kris Goto Cewek X Japan Lacey 72 Sepatu Vans Slip On Tali Zapato Sneakers Wanita Premium,legit_storejkt,"KAB. TANGERANG - CIKUPA, BANTEN, ID",Rp141.000,53% off,26,4.9,15,/Sepatu-Vans-Kris-Goto-Cewek-X-Japan-Lacey-72-Sepatu-Vans-Slip-On-Tali-Zapato-Sneakers-Wanita-Premium-i.57178299.8875719312?position=126
48,SEPATU VANS OLDSCHOOL CLASIC / SEPATU SEKOLAH / SEPATU PRIA DAN SEPATU WANITA SIZE 36-44,safarinugraha,"KAB. BANDUNG - CILENGKRANG, JAWA BARAT, ID",Rp75.000 - Rp85.000,,128,4.6,83,/SEPATU-VANS-OLDSCHOOL-CLASIC-SEPATU-SEKOLAH-SEPATU-PRIA-DAN-SEPATU-WANITA-SIZE-36-44-i.146155972.5373596815?position=128
49,MS Shoes - Sepatu Slip On Pria Vans Old Skhool Motif 3D Casual Selop Santai Cowo Kuliah Campuss,makmur.sepatu,"KAB. BANDUNG - CIPARAY, JAWA BARAT, ID",Rp75.000,32% off,"1,6RB",4.4,407,/MS-Shoes-Sepatu-Slip-On-Pria-Vans-Old-Skhool-Motif-3D-Casual-Selop-Santai-Cowo-Kuliah-Campuss-i.295526831.7957709390?position=129
50,SEPATU VANS  OLDSKOOL PATTA OFFWHITE PREMIUM PRIA KEREN AUTHENTIC ICC DT SEPATU SNEAKERS,sepatubrandedbandung,"KOTA BANDUNG - UJUNG BERUNG, JAWA BARAT, ID",Rp79.920,20% off,"1,9RB",4.6,461,/SEPATU-VANS-OLDSKOOL-PATTA-OFFWHITE-PREMIUM-PRIA-KEREN-AUTHENTIC-ICC-DT-SEPATU-SNEAKERS-i.15717822.5628016484?position=130
51,SEPATU VANS OLD SKOOL BLACKWHITE GRADE ORI,footgear28,"KAB. TANGERANG - CURUG, BANTEN, ID",Rp125.000,54% off,"8,9RB",4.9,18,/SEPATU-VANS-OLD-SKOOL-BLACKWHITE-GRADE-ORI-i.233760892.6795154807?position=131
52,COD Sepatu Vans Oldskool Bw N All White Sket Sekolah Olahraga Santai Sport Sneakers Murah 36-43,paradise57,"KOTA BANDUNG - BOJONGLOA KIDUL, JAWA BARAT, ID",Rp69.000,8% off,452,4.7,235,/COD-Sepatu-Vans-Oldskool-Bw-N-All-White-Sket-Sekolah-Olahraga-Santai-Sport-Sneakers-Murah-36-43-i.198349579.6033399468?position=132
53,sepatu casual pria vans OS full colour / sepatu sneakers merah polos / sepatu full red,rmd_store,"KOTA BANDUNG - PANYILEUKAN, JAWA BARAT, ID",Rp98.000,30% off,116,4.5,69,/sepatu-casual-pria-vans-OS-full-colour-sepatu-sneakers-merah-polos-sepatu-full-red-i.13206286.5715586840?position=133
56,Sepatu Vans Authentic Classics / Vans Old Skool Classics Black White,subtleltd,"KOTA BANDUNG - COBLONG, JAWA BARAT, ID",Rp266.000,5% off,12,5.0,4,/Sepatu-Vans-Authentic-Classics-Vans-Old-Skool-Classics-Black-White-i.71851577.3495940238?ads_keyword=vans%20oldskool&adsid=57293177&campaignid=34711099&position=181
57,(BISA COD) 100% PREMIUM OLDSCHOOL BLACK WHITE,bdgshoes,"KOTA BANDUNG - SUKAJADI, JAWA BARAT, ID",Rp158.000,1% off,"6,4RB",4.8,4RB,/(BISA-COD)-100-PREMIUM-OLDSCHOOL-BLACK-WHITE-i.37180187.1914088885?ads_keyword=vans&adsid=8201431&campaignid=5917816&position=182
58,Sepatu Vans Oldskool Black White Size 36-44 Premium Quality Made In China,siddiksneakersjakarta,"KOTA JAKARTA SELATAN - PESANGGRAHAN, DKI JAKARTA, ID",Rp129.900,57% off,10RB+,4.7,"6,3RB",/Sepatu-Vans-Oldskool-Black-White-Size-36-44-Premium-Quality-Made-In-China-i.20467359.1431441191?ads_keyword=sepatu%20vans&adsid=1384611&campaignid=1384611&position=183
59,Sepatu Sneakers Kasual Sepatu Sekolah Hitam santai,grosirsepatu69,"KOTA SURABAYA - BENOWO, JAWA TIMUR, ID",Rp70.000,50% off,369,4.7,89,/Sepatu-Sneakers-Kasual-Sepatu-Sekolah-Hitam-santai-i.215165947.6592566992?ads_keyword=sepatu%20vans&adsid=52723994&campaignid=32157051&position=184
60,SEPATU018 VANS AUTHENTIC FULL BLACK HITAM COKLAT OLDSKOOL  PREMIUM BNIB ICC IFC DT,jaketwijaya,"KAB. TANGERANG - PASAR KEMIS, BANTEN, ID",Rp50.000,75% off,"1,4RB",4.2,669,/SEPATU018-VANS-AUTHENTIC-FULL-BLACK-HITAM-COKLAT-OLDSKOOL-PREMIUM-BNIB-ICC-IFC-DT-i.76536147.4220687502?ads_keyword=vans%20oldskool&adsid=54512581&campaignid=17047476&position=185
61,Sepatu Casual Cewek Korea Sepatu Canvas Wanita Sepatu Cewek VANS Fashion Trend 2021,chensheva,"KAB. GRESIK - DRIYOREJO, JAWA TIMUR, ID",Rp159.000,50% off,93,4.8,42,/Sepatu-Casual-Cewek-Korea-Sepatu-Canvas-Wanita-Sepatu-Cewek-VANS-Fashion-Trend-2021-i.47458128.8507043648?position=186
62,OBRAL SEPATU COUPLE KELUARGA VANS OLD SKOOL VAULT OG PUTIH NAVY IMPORT QUALITY 26-43,obralsepatumurah,"KOTA JAKARTA SELATAN - PASAR MINGGU, DKI JAKARTA, ID",Rp72.250 - Rp118.750,15% off,130,4.4,49,/OBRAL-SEPATU-COUPLE-KELUARGA-VANS-OLD-SKOOL-VAULT-OG-PUTIH-NAVY-IMPORT-QUALITY-26-43-i.14347012.7163951932?position=187
63,VANS SLIP ON MICHAEL FEBRUARY PREMIUM BNIB UNISEX // SEPATU SANTAI CASUAL PRIA WANITA,shoes.store_jkt,"KOTA JAKARTA SELATAN - KEBAYORAN LAMA, DKI JAKARTA, ID",Rp125.000 - Rp133.400,8% off,"1,3RB",4.7,87,/VANS-SLIP-ON-MICHAEL-FEBRUARY-PREMIUM-BNIB-UNISEX-SEPATU-SANTAI-CASUAL-PRIA-WANITA-i.408487886.9132527598?position=188
65,Sepatu Sneakers / Sepatu Vans Oldskool Cream & White BNIB,expert.mart,"KOTA TANGERANG - PINANG (PENANG), BANTEN, ID",Rp110.000 - Rp135.000,51% off,"3,7RB",4.9,33,/Sepatu-Sneakers-Sepatu-Vans-Oldskool-Cream-White-BNIB-i.379643306.8718078282?position=190
66,Vans Sk8 Hi Classics Bw 100 % Original Made In China DT BNIB ORIGINAL MONEYBACK,sneakerslegend,"KAB. BANDUNG BARAT - PARONGPONG, JAWA BARAT, ID",Rp500.000 - Rp565.500,17% off,842,4.9,607,/Vans-Sk8-Hi-Classics-Bw-100-Original-Made-In-China-DT-BNIB-ORIGINAL-MONEYBACK-i.61641951.1600544440?position=191
67,Sepatu Vans Authentic MONO MAROON GUM Size 39-43 Grade Original Made In China With Box,siddiksneakersjakarta,"KOTA JAKARTA SELATAN - PESANGGRAHAN, DKI JAKARTA, ID",Rp129.900 - Rp300.000,57% off,295,4.5,188,/Sepatu-Vans-Authentic-MONO-MAROON-GUM-Size-39-43-Grade-Original-Made-In-China-With-Box-i.20467359.2306837398?position=192
68,(BISA COD) Sepatu Vans OldSkool Premium - Vans Full black - Sepatu Vans  - Sepatu Casual,ridwan101092,"KAB. BEKASI - TAMBUN SELATAN, JAWA BARAT, ID",Rp139.000,39% off,535,4.8,320,/(BISA-COD)-Sepatu-Vans-OldSkool-Premium-Vans-Full-black-Sepatu-Vans-Sepatu-Casual-i.107251241.5220610450?position=193
69,Sepatu Vans Slip On X Moma Made in China,boots_colection,"KOTA TANGERANG - PINANG (PENANG), BANTEN, ID",Rp145.000,42% off,6RB,4.8,12,/Sepatu-Vans-Slip-On-X-Moma-Made-in-China-i.462216525.3591777784?position=194
70,VANS ERA ORIGINAL MOTHER EARTH MULTICOLOR | VANS ORIGINAL 100% | SEPATU VANS WANITA | SEPATU VANS,clawstore.sneak,"KOTA JAKARTA SELATAN - PASAR MINGGU, DKI JAKARTA, ID",Rp599.000 - Rp735.000,16% off,166,5.0,37,/VANS-ERA-ORIGINAL-MOTHER-EARTH-MULTICOLOR-VANS-ORIGINAL-100-SEPATU-VANS-WANITA-SEPATU-VANS-i.232020050.5764960596?ads_keyword=vans%20wanita&adsid=26840626&campaignid=15998037&position=240
71,SNEAKYPAIR Elthea Sepatu Wanita Kanvas Canvas Shoes FBC  SNP1176 - R44&R9,sneakypairofficial,"KOTA BANDUNG - BANDUNG KIDUL, JAWA BARAT, ID",Rp199.000,39% off,453,4.9,293,/SNEAKYPAIR-Elthea-Sepatu-Wanita-Kanvas-Canvas-Shoes-FBC-SNP1176-R44-R9-i.143972192.8970167259?ads_keyword=sepatu%20converse&adsid=53317119&campaignid=32517011&position=241
72,sepatu Vans old skool Fetino sepatu kasual pria wanita // Autentik Fans / Vens Fatino / sepatu cowok,winiofficial,"KAB. MOJOKERTO - PURI, JAWA TIMUR, ID",Rp43.900 - Rp55.800,,905,4.3,177,/sepatu-Vans-old-skool-Fetino-sepatu-kasual-pria-wanita-Autentik-Fans-Vens-Fatino-sepatu-cowok-i.414567924.3490282311?ads_keyword=sepatu&adsid=49364362&campaignid=30102986&position=242
73,COD Sepatu Vans Oldskool Bw N All White Sket Sekolah Olahraga Santai Sport Sneakers - vans patta,barcelona85,"KOTA BANDUNG - RANCASARI, JAWA BARAT, ID",Rp92.500,26% off,341,4.3,174,/COD-Sepatu-Vans-Oldskool-Bw-N-All-White-Sket-Sekolah-Olahraga-Santai-Sport-Sneakers-vans-patta-i.38330666.5339695385?ads_keyword=sepatu%20vans%20old&adsid=11973605&campaignid=7619753&position=243
75,SEPATU PRIA/WANITA VANS OLD SKOOL BLACK WHITE OG 100% PREMIUM BNIB IMPORT MADE IN CHINA COD,gio_shoes.id,"KAB. BANDUNG - PASEH, JAWA BARAT, ID",Rp208.000,20% off,"1,1RB",5.0,6,/SEPATU-PRIA-WANITA-VANS-OLD-SKOOL-BLACK-WHITE-OG-100-PREMIUM-BNIB-IMPORT-MADE-IN-CHINA-COD-i.380019536.3478631795?position=245
76,Sepatu vans old skool full black pria top 1 di shopee,haitunani_store,"KOTA JAKARTA SELATAN - KEBAYORAN BARU, DKI JAKARTA, ID",Rp115.000,8% off,502,4.3,4,/Sepatu-vans-old-skool-full-black-pria-top-1-di-shopee-i.302832475.11016447777?position=246
77,Vans Old Skool Retro Block Pepsi Cola Original BNIB Pria,vanstuff,"KOTA JAKARTA SELATAN - PESANGGRAHAN, DKI JAKARTA, ID",Rp120,,450,0.0,0,/Vans-Old-Skool-Retro-Block-Pepsi-Cola-Original-BNIB-Pria-i.492508077.8687357397?position=247
78,VANS AUTHENTIC MONO FULL BLACK & BLACK WHITE PREMIUM BNIB MADE IN CHINA SEPATU PRIA/WANITA BISA COD,imamdemuh,"KAB. BANDUNG - PASEH, JAWA BARAT, ID",Rp195.000,22% off,828,4.5,10,/VANS-AUTHENTIC-MONO-FULL-BLACK-BLACK-WHITE-PREMIUM-BNIB-MADE-IN-CHINA-SEPATU-PRIA-WANITA-BISA-COD-i.158618819.2892524197?position=248
79,Vans Era Tiger Patchwork Original Bnib Global Market Cowo Cewe,vanstuff,"KOTA JAKARTA SELATAN - PESANGGRAHAN, DKI JAKARTA, ID",Rp120,,550,5.0,1,/Vans-Era-Tiger-Patchwork-Original-Bnib-Global-Market-Cowo-Cewe-i.492508077.9087346581?position=249
80,VANS OLD SKOOL STYLE 36 BLACK / BLANC DE BLANC ORIGINAL BNIB MADE IN CHINA,gantengsneakers,"KAB. BANDUNG BARAT - PARONGPONG, JAWA BARAT, ID",Rp650.000,,23,4.8,16,/VANS-OLD-SKOOL-STYLE-36-BLACK-BLANC-DE-BLANC-ORIGINAL-BNIB-MADE-IN-CHINA-i.41032399.9034471168?position=250
81,SEPATU WANITA VANS OFF THE WALL VELCRO,sumani_store,"KOTA JAKARTA SELATAN - KEBAYORAN BARU, DKI JAKARTA, ID",Rp120.000 - Rp125.000,,490,5.0,1,/SEPATU-WANITA-VANS-OFF-THE-WALL-VELCRO-i.508195253.11125159511?position=251
82,Sepatu Sneakers Wanita Terbaru Vans Slip On Kris Goto X Japan Lacey Flower Premium Quality BNIB,rdshoes26,"KAB. TANGERANG - PANONGAN, BANTEN, ID",Rp50.000 - Rp176.000,20% off,890,4.7,19,/Sepatu-Sneakers-Wanita-Terbaru-Vans-Slip-On-Kris-Goto-X-Japan-Lacey-Flower-Premium-Quality-BNIB-i.288438323.9970272339?position=252
83,Vans Slip On Checkerboard PRO Black White Couple Pria dan Wanita Original BNIB,vanstuff,"KOTA JAKARTA SELATAN - PESANGGRAHAN, DKI JAKARTA, ID",Rp120,,500,5.0,1,/Vans-Slip-On-Checkerboard-PRO-Black-White-Couple-Pria-dan-Wanita-Original-BNIB-i.492508077.8587357512?position=253
84,Vans Spicoli 4 Shades Clear Black,seven.goods,"KAB. GUNUNG KIDUL - WONOSARI, DI YOGYAKARTA, ID",Rp199.999,27% off,160,4.8,88,/Vans-Spicoli-4-Shades-Clear-Black-i.187770386.6020779988?position=254
85,Vans Original SK8 Low Black White Garansi Ori Barcode Tembus,vanspediaa,"KOTA BEKASI - BEKASI UTARA, JAWA BARAT, ID",Rp375.000 - Rp605.000,38% off,263,5.0,87,/Vans-Original-SK8-Low-Black-White-Garansi-Ori-Barcode-Tembus-i.28310653.3291470893?ads_keyword=vans&adsid=57815879&campaignid=34996209&position=300
86,Vans Slipon Mono Checkerboard,sandrisofficial,"KOTA CIMAHI - CIMAHI UTARA, JAWA BARAT, ID",Rp199.000,,225,4.6,125,/Vans-Slipon-Mono-Checkerboard-i.133928344.2773232810?ads_keyword=wkdaelpmissisiht&adsid=26333598&campaignid=4138160&position=301
87,SEPATU Vans x SpongeBob Old Skool Bikini Bubble Sneakers,distrik.store,"KOTA BANDUNG - CIBEUNYING KIDUL, JAWA BARAT, ID",Rp522.500,5% off,0,0.0,0,/SEPATU-Vans-x-SpongeBob-Old-Skool-Bikini-Bubble-Sneakers-i.19491199.10138582846?ads_keyword=sepatu%20vans&adsid=62105445&campaignid=37355700&position=302
88,Sepatu Vans Authentic Hitam Gum Premium Quality Waffle DT,kios.kita,"KOTA JAKARTA BARAT - TAMAN SARI, DKI JAKARTA, ID",Rp127.500,15% off,"2,1RB",4.6,"1,2RB",/Sepatu-Vans-Authentic-Hitam-Gum-Premium-Quality-Waffle-DT-i.6325227.198693535?ads_keyword=sepatu%20vans&adsid=576262&campaignid=576262&position=303
89,Sepatu Sneakers Casual pria wanita pendek & boots 36-43,sepatu_santai,"KOTA SURABAYA - BENOWO, JAWA TIMUR, ID",Rp67.200,4% off,"8,2RB",4.5,"4,1RB",/Sepatu-Sneakers-Casual-pria-wanita-pendek-boots-36-43-i.293821398.5446361978?ads_keyword=sepatu&adsid=15882975&campaignid=9467294&position=304
90,vans the simpsons sepatu slip on berdineshoe,berdineshoe,"KOTA SURABAYA - KREMBANGAN, JAWA TIMUR, ID",Rp158.000,21% off,400,5.0,1,/vans-the-simpsons-sepatu-slip-on-berdineshoe-i.19827982.11830208499?position=305
91,Sepatu Vans Oldshool OG Hitam Putih Premium Quality,expert.mart,"KOTA TANGERANG - PINANG (PENANG), BANTEN, ID",Rp132.000 - Rp138.000,48% off,383,5.0,3,/Sepatu-Vans-Oldshool-OG-Hitam-Putih-Premium-Quality-i.379643306.10619253569?position=306
92,OBRAL SEPATU VANS SLIP ON OG BLACK WHITE,ayu_sneakers,"KOTA JAKARTA SELATAN - KEBAYORAN BARU, DKI JAKARTA, ID",Rp75.000 - Rp175.000,,852,5.0,1,/OBRAL-SEPATU-VANS-SLIP-ON-OG-BLACK-WHITE-i.32029529.11111390965?position=307
93,SEPATU VANS SLIP ON OG CHECKERBOARD OFF WHITE BLACK BNIB,rindi.storee,"KOTA JAKARTA SELATAN - KEBAYORAN LAMA, DKI JAKARTA, ID",Rp30.000 - Rp175.000,,704,5.0,2,/SEPATU-VANS-SLIP-ON-OG-CHECKERBOARD-OFF-WHITE-BLACK-BNIB-i.469777190.9771290871?position=308
94,SEPATU VANS AUTHENTIC SNEAKEARS HITAM PUTIH TULANG PREMIUM BNIB ICC IFC DT,albilastar33,"KOTA BANDUNG - CIBIRU, JAWA BARAT, ID",Rp85.000,53% off,63,4.6,40,/SEPATU-VANS-AUTHENTIC-SNEAKEARS-HITAM-PUTIH-TULANG-PREMIUM-BNIB-ICC-IFC-DT-i.32242690.1964752756?position=309
95,(FREE GIFT !!!) VANS SLIP ON CLASSIC CHECKERBOARD BLACK WHITE WAFFLE DT GRADE ORI BNIB,adam.novrizal,"KOTA BEKASI - BEKASI TIMUR, JAWA BARAT, ID",Rp120.000,,2RB,5.0,5,/(FREE-GIFT-!!!)-VANS-SLIP-ON-CLASSIC-CHECKERBOARD-BLACK-WHITE-WAFFLE-DT-GRADE-ORI-BNIB-i.113874130.10610088597?position=310
